Notice ID,Published Date,Tender Title,Tender Description,Tender Value,Tender Value-currency,Tender Start Date,Tender End Date,Classification Scheme,Classification Code,Classification Description,Buyer Name,Buyer ID-scheme,Buyer ID,Buyer Locality
1ad04fa7-9111-4bb5-bf6d-a563552961e3-371659-tender_246229-871754,2020-07-21T15:34:10Z,605789 - Area 14 Bridges Concrete Testing - Package 1,The principle objective of this project is carry out concrete testing works to Tyne Tunnel East and West bridges and Coatham Interchange North and South bridges as outlined in the Works Information and accompanying specifications and testing drawings.,0.0,GBP,,2020-08-14T00:00:00Z,CPV,45223200,Structural works,Highways England,,,Darlington
69ab985e-ebd0-4310-b6e1-141ba291cff7-372141-tender_246230-872361,2020-07-23T16:06:38Z,Area 14 Network-wide Road Markings and Studs Retro-Reflectivity Survey,"Retro-Reflectivity survey of road markings and studs, including those at junctions, on the Area 14 network",0.0,GBP,,2020-08-11T00:00:00Z,CPV,34921000,Road-maintenance equipment,Highways England,,,Darlington
d0877546-5883-49dc-b2f5-f62a1f21984e-372057-tender_244964-868908,2020-07-23T12:46:38Z,Supply Chain and Market Analytics 2020 to 2022,"Highways England requires a supply chain analytics service to support Highways England in being better informed about our current and potential supply chain and react to market challenges.

This service will provide, but will not be limited to; market analysis, category analysis, product analysis, commodity analysis, economic trend analysis, future state analysis and supply chain risk management. The delivery of this service will be integral in supporting the delivery of the Roads Investment Strategy (RIS) 2 Programme and contributing to the development of RIS 3.

The service will provide access to private intelligence databases as well as industry and sector experts. The service will deliver analysis reports interpreting the intelligence and informing Highways England decisions on commercial, procurement and supply chain strategies and challenges.

The Contract will be for two years with the option to extend by one year (3 years total),",0.0,GBP,2020-07-23T12:46:35Z,2020-08-24T00:00:00Z,CPV,73210000,Research consultancy services,Highways England,,,LEEDS
