Notice ID,Published Date,Buyer Name,Buyer ID-scheme,Buyer ID,Buyer Locality,Supplier Name,Supplier ID-scheme,Supplier ID,Supplier Address - locality,Supplier Address - postcode,Supplier Address - country,Supplier Address - street address,Date Contract Awarded,Contract Start Date,Contract End Date,Award Title,Award Description,Award Documents URL,Classification Scheme,Classification Code,Classification Description,Award Value,Award Value - currency
a5888ddf-75b1-4cb0-b7e2-bcb693580f54-377049-tender_246229-881214,2020-08-20T14:42:37Z,Highways England,,,Darlington,Route One,,,,,,"Unit 1 Innovation Square, Green Lane Industrial Estate, Featherstone",2020-08-20T00:00:00Z,2020-08-24T00:00:00Z,2021-03-31T00:00:00Z,605789 - Area 14 Bridges Concrete Testing - Package 1,The principle objective of this project is carry out concrete testing works to Tyne Tunnel East and West bridges and Coatham Interchange North and South bridges as outlined in the Works Information and accompanying specifications and testing drawings.,,,,,109000.0,GBP
bdd934bb-e82a-463a-ad85-b50fcfb517d2-377167-tender_141474-881485,2020-08-21T10:29:19Z,Highways England,,,Birmingham,Atkins,,,,,,Surrey,2020-06-30T00:00:00Z,2020-07-01T00:00:00Z,2021-07-31T00:00:00Z,1-1115 Safer Roads Design Technical Support,"Highways England is looking for the provision of technical support services to provide technical assurance and advice, including the review of Departures from Standards and applications for non-prescribed traffic signs Authorisations. 

The Safer Roads Design (SRD) team provides advice, technical assurance and governance, covering road geometry, traffic signs and road markings and traffic sign/signal gantry positioning, to scheme project managers and designers for all types of Highways England road projects.  The team also provides recommendations on departures from standards and reviews applications for non-prescribed traffic signs prior to submission to the Department for Transport (DfT) for authorisation by the Secretary of State for Transport. 
Due to the limited availability of specialist resources in the SRD team, there is a need for additional specialist professional engineering resource to assist in the delivery of this varied workload through three discrete sub-tasks.",,,,,249972.04,GBP
a1539a6d-2d6f-4045-ba07-592b24300b17-376569-tender_244557-880630,2020-08-18T15:03:45Z,Highways England,,,Darlington,Socotec Asbestos Ltd,,,,,,"Socotec House, Bretby Business Park, Burton Upon Trent, DE15 0YZ",2020-08-11T00:00:00Z,2020-08-17T00:00:00Z,2021-03-31T00:00:00Z,602476 - Area 14 Asbestos Surveys,"Asbestos Refurbishment Surveys, Asbestos Management Surveys and Depot Re-inspection Surveys.",,,,,8512.4,GBP
8ad6148d-4458-4362-a2f8-5b82b5c0e5d1-376541-tender_141474-880604,2020-08-18T14:14:10Z,Highways England,,,Birmingham,Arup,,,,,,London,2020-06-10T00:00:00Z,2020-06-10T00:00:00Z,2020-09-04T00:00:00Z,1-1107 Air Quality Innovation Sponsorhip Support,"Highways England is looking to set up a Task to deliver technical and project management to the winning bids for the air quality innovation call.  The Task will also support programme management of the Air Quality Designated Fund as it is transitioned into the Environment & Wellbeing Fund for this second Road Investment Period.

The aim of this contract is to support Highways England: 

-	To deliver technical and project management to the projects that were winners of the Air Quality Innovation Call through to their completion planned for August 2020.
-	To transition management of the air quality designated fund to internal resource in the Designated Funds Programme Management Office
-	To support the establishment of the Air Quality Leadership Group and the transition of pollution climate mapping (PCM) link mitigation reporting to Operations colleagues on that Group.  Such activity supporting Government's National Air Quality Plan is reported monthly to the Office of Road & Rail (ORR).",,,,,41981.6,GBP
925a9dd6-9214-4fde-9b46-801f483c9b1f-376449-tender_239780-878725,2020-08-18T10:36:59Z,Highways England,,,Guildford,Costain Limited,GB-COH,00610201,,,,"Vanwall Business Park, Maidenhead, UK",2020-08-06T00:00:00Z,2020-08-20T00:00:00Z,2021-11-02T00:00:00Z,Area 4 Asset Delivery Construction Works Framework (Area 4 Interim) Contract,"The requirement is to engage a contractor to undertake works within the Highways England South-East region and specifically within Area 4.

This will include but not limited to - Road lighting & electrical; Roads Pavement; General Civil Engineering, Geotechnical and Drainage; Technology; Landscaping & Ecology; Road marking & studs; Road restraint systems & fencing; Temporary traffic management; Structures, structural services, and Expansion joints; and any other similar duties.",,,,,50000000.0,GBP
d5ca3ecf-22fc-4abe-aff5-50daafbdfd69-376384-tender_244390-880422,2020-08-17T17:43:48Z,Highways England,,,Almondsbury,Quantum Geotechnic,,,,,,Llanelli,2020-08-17T00:00:00Z,2020-09-01T00:00:00Z,2020-09-08T00:00:00Z,570135 M5 J28-29 Exeter Waterloo Railway Trial Pits,16 trial holes and soil testing on M5 J28-29,,,,,13085.6,GBP
