Notice ID,Published Date,Tender Title,Tender Description,Tender Value,Tender Value-currency,Tender Start Date,Tender End Date,Classification Scheme,Classification Code,Classification Description,Buyer Name,Buyer ID-scheme,Buyer ID,Buyer Locality
5424b848-8dcf-4958-bec7-fe071a20a5d4-375973-tender_248222-879937,2020-08-14T12:37:00Z,566473 A36 STAPLEFORD GPR SURVEY,Ground Penetration Radar Survey of site to establish location of existing services and provide accurate for future works,0.0,GBP,2020-08-14T12:37:00Z,2020-09-11T12:00:00Z,CPV,71351810,Topographical services,Highways England,,,"Warrington , Cheshire"
e7f74c94-98f1-4f11-903d-f054b3f9b5ad-375967-tender_248227-879936,2020-08-14T12:27:17Z,566473 A36 STAPLEFORD BURIED UTILITY SURVEY (TRIAL HOLES),Excavation of 4 no trial holes to establish buried utilities location and type.,0.0,GBP,2020-08-14T12:27:17Z,2020-09-11T12:00:00Z,CPV,71351500,Ground investigation services,Highways England,,,"Warrington , Cheshire"
50e12842-e748-48c2-b015-cd406295f8ef-375966-tender_248240-879935,2020-08-14T12:20:50Z,566473 A36 STAPLEFORD DRAINAGE CCTV SURVEY,"Drainage Condition CCTV survey of existing assets - confirming connectivity, dimensions and condition to enable an accurate design to be completed.",0.0,GBP,2020-08-14T12:20:50Z,2020-09-11T12:00:00Z,CPV,45232452,Drainage works,Highways England,,,"Warrington , Cheshire"
e14118ee-b2bf-4909-983c-a575fff714e8-375961-tender_248246-879932,2020-08-14T12:12:51Z,566473 A36 STAPLEFORD TOPOGRAPHICAL SURVEY,Topographical survey enabling vegetation clearance,0.0,GBP,2020-08-14T12:12:51Z,2020-09-11T12:00:00Z,CPV,71351810,Topographical services,Highways England,,,"Warrington , Cheshire"
461e7877-02ba-4eec-a86e-f69ad6025f87-375555-tender_247711-879380,2020-08-12T13:53:30Z,570122 - South West - Pavement Ultra HD Video Surveys,"Highways England is looking to procure services to undertake Pavement Condition Video Surveys as part of the South West programme of works.

Please note, you will need to be a registered TST supplier in order to bid for this opportunity. For further details please contact nationaltst@highwaysengland.co.uk.",0.0,GBP,2020-08-12T13:53:30Z,2020-09-11T12:00:00Z,CPV,71355000,Surveying services,Highways England,,,Warrington
