Notice ID,Published Date,Buyer Name,Buyer ID-scheme,Buyer ID,Buyer Locality,Supplier Name,Supplier ID-scheme,Supplier ID,Supplier Address - locality,Supplier Address - postcode,Supplier Address - country,Supplier Address - street address,Date Contract Awarded,Contract Start Date,Contract End Date,Award Title,Award Description,Award Documents URL,Classification Scheme,Classification Code,Classification Description,Award Value,Award Value - currency
abd701bc-e440-4af7-96dc-b25635aacf6b-366998-tender_141474-865580,2020-06-29T12:41:42Z,Highways England,,,Bristol,ARUP,,,,,,UK,2020-06-29T00:00:00Z,2020-07-06T00:00:00Z,2021-03-31T00:00:00Z,1-1089 Area 14 Bridge Assessments - Package 1,1-1089 Area 14 Bridge Assessments - Package 1,,,,,59457.0,GBP
9ee69e8d-f8a7-46fd-adad-51d44f2be0db-366900-tender_240485-865443,2020-06-29T09:17:29Z,Highways England,,,Darlington,LandScope Engineering Ltd,,,,,,"The Chart House, Picklescott, Church Stretton, Shropshire, SY6 6NT",2020-06-22T00:00:00Z,2020-07-01T00:00:00Z,2020-07-15T00:00:00Z,570124 - A46 Four Wind Farm MP 5/2 to 2/7 FHS - Topo Survey,Topographical survey at A46 Four Winds Farm MP5/2 to 2/7 FHS to support in the development of a design solution for the flooding hotspot.,,,,,8450.0,GBP
f9e0e335-18a8-41d4-bc7a-bf3e12911519-367687-tender_141474-866578,2020-07-01T15:33:00Z,Highways England,,,Bristol,Arup,,,,,,Newcastle upon Tyne,2020-07-01T00:00:00Z,2020-07-01T00:00:00Z,2021-03-31T00:00:00Z,1-1123 Spatial Planning Review,"Highways England is looking to set up a contract for provision of a Programme Manager. We would be looking for The Consultant to provide a part time Programme Manager resource from 15th June 2020 to 31st March 2021 to programme manage the delivery of a transformation project called Spatial Planning Review. The Spatial Planning Review is a complex transformation for Operations which will involve the development and establishment of new ways of working across all of Operations Spatial Planning Teams, improving the service provided to customers and developing the professionalism across the directorate.",,,,,149600.0,GBP
5ed888e6-0070-4d70-9fae-c83e67bff9dc-367465-tender_241491-866186,2020-07-01T08:22:50Z,Highways England,,,Darlington,Acorn Environmental Management Group,,,,,,2a Eagle Road North Moons Moat Redditch Worcestershire B98 9HF,2020-06-29T00:00:00Z,2020-07-01T00:00:00Z,2020-09-25T00:00:00Z,603429 - SWAD 2020 Tree Condition Survey Phase 2,Tree condition inspection and survey of highways trees for specified lengths of the M5 J9 to J31 (Excluding the Smart Motorway Zone),,,,,37200.0,GBP
1f2584ed-9c57-41a4-a1ea-ee728e01ddf3-368269-tender_225981-866805,2020-07-03T16:13:28Z,Highways England,,,Birmingham,Amalgamated Construction Ltd (AMCO Rail),GB-COH,00995892,,,,"Whaley Road, Barugh, Barnsley, South Yorkshire, S75 1HT",2020-07-01T00:00:00Z,2020-07-02T00:00:00Z,2027-07-02T00:00:00Z,Historical Railways Estate (HRE) - Works Framework 2020,"The award of the Historical Railways Estate (HRE) - Works Framework 2020. The key purpose of this tender exercise is to deliver the Works element of the Historical Railways Estate (HRE) Provision. The works framework will provide the minor works intervention and, from time to time, reactive maintenance for 3190 assets throughout mainland Great Britain. 

Lot 1 - National - Major Works 
Typically, these orders equate to £200k or above. All works on this lot are awarded following secondary competition. This lot will hold three suppliers.

Lot 2 - North - Minor Works & Emergency response 
Typically, these orders equate to less than £200k. All works will be awarded via Direct Allocation. This lot will hold three suppliers.

Lot 3 - South - Minor Works & Emergency response 
Typically, these orders equate to less than £200k. All works will be awarded via Direct Allocation on this. This lot will hold three suppliers.",,,,,254000000.0,GBP
bd235fa4-9914-431e-afc1-9ede00097a66-367347-tender_141474-866030,2020-06-30T15:16:40Z,Highways England,,,Birmingham,Atkins,,,,,,Surrey,2020-06-15T00:00:00Z,2020-06-15T00:00:00Z,2021-12-16T00:00:00Z,1-1066 Support for LTC Transition Process,"The LTC project is currently supported by a long running contract referred to as the Technical Partner. This wide-ranging contract was originally set up for the development phase of the project. The activity under the Technical Partner contract is now being refocused on activities to support the main works procurement and DCO process. Highways England (HE) is aiming to procure a limited volume of specialist technical services to support HE in the transition of the LTC project from the Development phase into the Delivery Phase, where a Delivery partner as well as the Technical Partner will support HE. 
The Delivery Partner contract is currently in the procurement phase. The work required under this work package will not be carried out by the Technical partner to avoid conflicts. This work package is for limited time period until the Delivery Partner for LTC is mobilised sufficiently to take over activities (expected late Q3/Q4 2020/21). In addition to supporting the transition some other services are included to support HE staff where the use of Technical Partner staff would create a conflict.",,,,,819939.92,GBP
e4dc20c9-a4d1-467f-a905-aece31801bb5-367332-tender_141474-866011,2020-06-30T14:55:32Z,Highways England,,,Birmingham,ARUP,,,,,,London,2020-06-16T00:00:00Z,2020-06-16T00:00:00Z,2022-09-19T00:00:00Z,1-1065 Regulatory Monitoring and Compliance Technical Partne,"Highways England is looking to set up a contract for a regulatory monitoring and compliance technical partner with experience of working and advising regulated companies. The contract will support the Monitoring and Road Investment Strategy (RIS) Compliance Division of the Strategy and Planning Directorate. The division is responsible for managing the company's compliance with our obligations as set out in the RIS, our License and Framework. It also manages the company's critical stakeholder relationships with the Department for Transport, Transport Focus and the Office of Rail and Road (ORR).",,,,,709657.1,GBP
