Notice ID,Published Date,Buyer Name,Buyer ID-scheme,Buyer ID,Buyer Locality,Supplier Name,Supplier ID-scheme,Supplier ID,Supplier Address - locality,Supplier Address - postcode,Supplier Address - country,Supplier Address - street address,Classification Scheme,Classification Code,Classification Description,Transaction ID,Transaction Date,Transaction Amount,Transaction Currency
a5888ddf-75b1-4cb0-b7e2-bcb693580f54-377049-tender_246229-881214_trans1,2020-09-27T14:42:37Z,Highways England,,,Darlington,Route One,,,,,,"Unit 1 Innovation Square, Green Lane Industrial Estate, Featherstone",CPV,45223200,Structural works,,2020-09-16T00:00:00Z,109000.0,GBP
bdd934bb-e82a-463a-ad85-b50fcfb517d2-377167-tender_141474-881485_trans1,2020-09-26T10:29:19Z,Highways England,,,Birmingham,Atkins,,,,,,Surrey,CPV,73000000,Research and development services and related consultancy services,,2020-07-28T00:00:00Z,249972.04,GBP
a1539a6d-2d6f-4045-ba07-592b24300b17-376569-tender_244557-880630_trans1,2020-09-24T15:03:45Z,Highways England,,,Darlington,Socotec Asbestos Ltd,,,,,,"Socotec House, Bretby Business Park, Burton Upon Trent, DE15 0YZ",CPV,45262660,Asbestos-removal work,,2020-09-03T00:00:00Z,8512.4,GBP
8ad6148d-4458-4362-a2f8-5b82b5c0e5d1-376541-tender_141474-880604_trans1,2020-09-20T14:14:10Z,Highways England,,,Birmingham,Arup,,,,,,London,CPV,73000000,Research and development services and related consultancy services,,2020-07-06T00:00:00Z,41981.6,GBP
925a9dd6-9214-4fde-9b46-801f483c9b1f-376449-tender_239780-878725_trans1,2020-09-26T10:36:59Z,Highways England,,,Guildford,Costain Limited,GB-COH,00610201,,,,"Vanwall Business Park, Maidenhead, UK",CPV,45233100,"Construction work for highways, roads",,2020-09-02T00:00:00Z,50000000.0,GBP
d5ca3ecf-22fc-4abe-aff5-50daafbdfd69-376384-tender_244390-880422_trans1,2020-09-18T17:43:48Z,Highways England,,,Almondsbury,Quantum Geotechnic,,,,,,Llanelli,CPV,45200000,Works for complete or part construction and civil engineering work,,2020-09-12T00:00:00Z,13085.6,GBP
