Notice ID,Published Date,Buyer Name,Buyer ID-scheme,Buyer ID,Buyer Locality,Supplier Name,Supplier ID-scheme,Supplier ID,Supplier Address - locality,Supplier Address - postcode,Supplier Address - country,Supplier Address - street address,Date Contract Awarded,Contract Start Date,Contract End Date,Award Title,Award Description,Award Documents URL,Classification Scheme,Classification Code,Classification Description,Award Value,Award Value - currency
205bfa20-d844-4ea8-b716-e5e7f0e102cc-364351-leedscity001-dn482469-60993016,2020-06-15T14:54:32Z,Leeds City Council,,,Leeds,The Data City Innovations Limited,,,,,,"3rd Floor - Munro House, Duke Street, Leeds LS9 8AG",2020-06-15T00:00:00Z,2020-06-16T00:00:00Z,2020-07-01T00:00:00Z,Analysis of Discretionary Grant Services,Analysis of Discretionary Grant Services,,,,,15000.0,GBP
c189d895-aab6-4d3b-b00b-1bab1f3a9b48-364348-leedscity001-dn468362-56339752,2020-06-15T14:49:34Z,Leeds City Council,,,Leeds,Apect Building Solutions Ltd,,,,,,"7a Asquith Avenue Business Park, Asquith Avenue, Morley  LS27 7RZ",2020-06-15T00:00:00Z,2020-06-16T00:00:00Z,2020-09-04T00:00:00Z,"Bardsey Primary School, summer works",Summer works to Bardsey Primary School,,,,,40081.9,GBP
9068f423-fc3c-4b16-86a4-daac26d535d5-364311-leedscity001-dn467362-71200871,2020-06-15T13:55:34Z,Leeds City Council,,,Leeds,Circles Training & Consultancy Limited,,,,,,"63 Shaftesbury Avenue, Leeds, West Yorkshire LS8 1DR",2020-05-29T00:00:00Z,2020-06-01T00:00:00Z,2023-05-31T00:00:00Z,Restorative Practice Training - Specialist and General,Restorative Practice Training - Specialist and General,,,,,126000.0,GBP
084320d0-1450-43c5-ad9c-47d33eb28d1f-364207-leedscity001-dn467751-80140338,2020-06-15T10:17:59Z,Leeds City Council,,,Leeds,Apetito Limited,,,,,,"Canal Road, 
Trowbridge, 
Wiltshire 
BA14 8RJ,",2020-06-15T00:00:00Z,2020-07-01T00:00:00Z,2023-06-30T00:00:00Z,Supply of Individual Frozen Meals,Supply of Individual Frozen Meals,,,,,705000.0,GBP
0c658f64-16e6-47b0-ad25-abfa5afdedbb-364187-leedscity001-dn482446-62528434,2020-06-15T09:03:05Z,Leeds City Council,,,Leeds,Fore Consulting,,,,,,"34 Wellington Street, Leeds LS1 2DE",2020-06-15T00:00:00Z,2020-07-01T00:00:00Z,2021-06-30T00:00:00Z,Maintain and Update the City Centre Microsimulation Model - Waiver,"Review, Updating and Maintenance of Microsimulation Model",,,,,25000.0,GBP
2c1b8dfe-10c7-44f6-8895-d7da9ba822d4-365302-leedscity001-dn468984-89874393,2020-06-19T13:39:48Z,Leeds City Council,,,Leeds,Tucker & Tunstalls Ltd.,,,,,,"Whitehall Industrial Estate, Whitehall Park, Leeds LS12 5JB",2020-06-19T00:00:00Z,2020-06-20T00:00:00Z,2020-09-04T00:00:00Z,Shire Oak C of E Primary School,Shire Oak Primary School - Roofing,,,,,114729.05,GBP
04ab2c0a-51d2-4ad8-b31c-80792d38129c-365252-leedscity001-dn469329-06396781,2020-06-19T10:51:09Z,Leeds City Council,,,Leeds,Watershed Roofing Ltd,,,,,,"Thorncliffe Road, Bradford, West Yorkshire, BD8 7DD",2020-06-19T00:00:00Z,2020-06-20T00:00:00Z,2020-09-04T00:00:00Z,Horsforth Newlaithes Primary School - roof works,Horsforth Newlaithes Primary School Roof,,,,,106920.0,GBP
